{
  "contractVersion": "1",
  "objective": "在中断后从最新意图合同继续分析",
  "scope": ["交互治理流程"],
  "mustPreserve": ["最新用户不变量"],
  "allowedTransitions": ["ResumeAnalysis"],
  "forbiddenTransitions": ["ResumeWithStaleRevision"],
  "acceptanceSignals": ["旧revision不再允许执行"],
  "counterexamples": ["中断后继续使用被用户否定的设计"],
  "nonGoals": ["不自动执行运行时动作"],
  "assumptions": [],
  "unresolvedQuestions": [],
  "intentAlignmentStatus": "partial",
  "executionDecision": "analyze-only",
  "revision": 3,
  "sourceRefs": ["interaction-governance-contract"],
  "recovery": {"resumeAction": "重新读取revision=3的合同", "partialStatePolicy": "丢弃旧计划并保留失败证据"}
}
